{
  "review_id": "",
  "skill_version": "rigorous-reviewer v2.2.1",
  "contract_status": "draft",
  "material_basis": {
    "title": "",
    "abstract_or_summary": "",
    "target_venue": "",
    "materials_available": [],
    "missing_decisive_material": []
  },
  "central_claim_dependency_map": [
    {
      "claim_id": "C1",
      "claim": "",
      "depends_on": [],
      "decisive_evidence_needed": "",
      "fragile_assumption": ""
    }
  ],
  "decisive_evidence_thresholds": [
    {
      "threshold_id": "T1",
      "claim_id": "C1",
      "support_condition": "",
      "weakening_or_refuting_condition": "",
      "claim_narrowing_condition": ""
    }
  ],
  "mandatory_reviewer_dimensions": [
    "novelty",
    "domain_validity",
    "methods_statistics",
    "reproducibility",
    "alternative_explanations",
    "reporting_transparency"
  ],
  "failure_conditions": [
    {
      "condition_id": "F1",
      "severity_floor": "Major Revision",
      "condition": "",
      "affected_claim_id": "C1",
      "can_be_resolved_by": ""
    }
  ],
  "evidence_that_changes_recommendation": {
    "strengthen": [],
    "weaken": [],
    "force_claim_narrowing": []
  },
  "prohibited_post_hoc_standard_shifts": [],
  "contract_amendments": []
}
